{
  "schemaVersion": "r4.gate-b-core.construction-evidence.v1",
  "status": "CORE_REPOSITORY_REVIEWABLE_YELLOW",
  "generatedAt": "2026-08-07T11:40:06.000Z",
  "authority": {
    "constructionPacketSha256": "sha256:5c8ec32ca40ca9e6f67f96e8b2cec8f378c04fef8bc59387e98f5d79cbe0b3e6",
    "ownerReviewSha256": "sha256:2ad228be60be0730056a4c1195b2ce1be8db11ee9e308e4bc4559edc226bb299",
    "proposalHead": "5ccfcf1aaea0f1c5f164e29d91237c6e1842df6e",
    "proposalTree": "15aa88dcd33719f9c8a0c9c0455d1c7ecdf8a60f",
    "correctionConstructionGrant": "APPROVED",
    "retryExecutionGrant": "NOT_REQUESTED",
    "firstProviderCallTestGrant": "NOT_REQUESTED",
    "providerSessions": 0,
    "providerBytes": 0,
    "spendUsd": 0
  },
  "preflight": {
    "approvedBindingsMatched": true,
    "branch": "codex/r4-gate-a-build",
    "upstreamDivergence": "0/0",
    "packageLockSha256": "sha256:d7a56f2e40ffc80f03413c8e697e1a9a9199dcb8873cedc43cd421a2b265c812",
    "baselineTestsPassed": true
  },
  "coreSurface": {
    "status": "GREEN_OFFLINE",
    "testsPassed": 8,
    "realEffects": 0,
    "aggregateVerdict": "GREEN"
  },
  "postgresConstruction": {
    "status": "CORE_CONSTRUCTED_STATIC_ONLY",
    "testsPassed": 12,
    "realEffects": 0,
    "aggregateVerdict": "YELLOW"
  },
  "codexConstruction": {
    "status": "GREEN_FAKE_PORT_ONLY",
    "testsPassed": 13,
    "realEffects": 0,
    "aggregateVerdict": "YELLOW"
  },
  "macosConstruction": {
    "status": "GREEN_FAKE_EXECUTOR_AND_SWIFT_TESTS_ONLY",
    "testsPassed": 21,
    "realEffects": 0,
    "aggregateVerdict": "YELLOW"
  },
  "aggregateConstruction": {
    "status": "CORE_REPOSITORY_REVIEWABLE_YELLOW",
    "verdict": "YELLOW",
    "blockers": [
      "postgres_race_worker_call_bytes_and_persistent_verifiers",
      "host_binding_and_core_physical_runner",
      "macos_signed_helper_physical_executor"
    ],
    "laneCount": 9,
    "injectedFaultCaseCount": 16,
    "cleanupAlwaysRan": true,
    "bodyFreeCheckpointsPassed": true,
    "aiLaneEnabled": false
  },
  "regressions": {
    "nodeTests": 381,
    "swiftTests": 19,
    "typecheckPassed": true,
    "gateAAndFullPassed": true,
    "packageLockUnchanged": true
  },
  "effectAudit": {
    "dockerCommands": 0,
    "postgresProcesses": 0,
    "realCodexCalls": 0,
    "sandboxExecCalls": 0,
    "threadStarts": 0,
    "turnStarts": 0,
    "providerCalls": 0,
    "providerBytes": 0,
    "networkCalls": 0,
    "appAssemblies": 0,
    "signingCalls": 0,
    "keychainCalls": 0,
    "localAuthenticationCalls": 0,
    "secureEnclaveOperations": 0,
    "realGuestBytes": 0,
    "externalMessages": 0,
    "deploys": 0,
    "merges": 0
  },
  "cleanup": {
    "status": "GREEN",
    "constructionTempRootAbsent": true,
    "fakeChildrenAbsent": true,
    "generatedBuildBytesCommitted": false
  },
  "immutableBindings": {
    "docs/R4-GATE-B-CORE-CORRECTION-CONSTRUCTION-OWNER-REVIEW.md": "sha256:2ad228be60be0730056a4c1195b2ce1be8db11ee9e308e4bc4559edc226bb299",
    "docs/R4-GATE-B-CORE-CORRECTION-CONSTRUCTION-PACKET.md": "sha256:5c8ec32ca40ca9e6f67f96e8b2cec8f378c04fef8bc59387e98f5d79cbe0b3e6",
    "docs/R4-GATE-B-CORRECTION-SCOPE-DECISION-BRIEF.md": "sha256:c20e987cfb7ff7cc2b73c1d13584a8d7955bd5c3407369bed3a98ce37700f86f",
    "docs/R4-TECHNICAL-CONTROL-PACKET.md": "sha256:e417836bd67bdef73f401919e83de3d58f68960499bd5c356951b48408adfff5",
    "package-lock.json": "sha256:d7a56f2e40ffc80f03413c8e697e1a9a9199dcb8873cedc43cd421a2b265c812",
    "schemas/r4/gate-b/artifact-index.json": "sha256:2fc4f5ec2554f43a8c9a0d93950a5ce1198b91555f361af53d80c7664c5b6a9f"
  },
  "constructedFiles": {
    "apps/room/app/layout.tsx": "sha256:f27301a6ad8e728e6b7ec30c9080b8fd467d0d6502e2ccfa844ac4a925b44a05",
    "apps/room/app/owner/interactions/[interactionId]/page.tsx": "sha256:eb9f36e9ac10b1d359d5fd63b7c1ef67191f69759824d2913bc9277545d8f9e8",
    "apps/room/app/owner/page.tsx": "sha256:296760e100e0dbaa4371f512d01676fc303a3b490472f880cb7f3d09edb397aa",
    "apps/room/app/page.tsx": "sha256:7af90c21ae171820be0c84d88570dfd1a4a1b254a28a2acdc980ad6d8356fb1b",
    "apps/room/app/private/[projectionId]/page.tsx": "sha256:07ba3b9455394ac8a8923f988c8538d2645901163e2035a75d3477a42a3d9e99",
    "apps/room/src/application.ts": "sha256:82781f0924f96536db3b80eea550cfef61584e08baa9114308ad01e796b5d45d",
    "apps/room/src/components/GuestStatus.tsx": "sha256:886dd6e57a22fe0da8cf638a01282e5a5a17a21316cc82959d7f64018cd49132",
    "apps/room/src/core-policy.ts": "sha256:4f0d72416388ed7329fed957a202750549bc8cb569dcd4c58dade615d6892fd5",
    "apps/room/src/http.ts": "sha256:7eab16f6fd48aec0396a613d3824f45f8630a6f6c76e99ea22f2244161663b94",
    "apps/room/src/operation-inventory.ts": "sha256:cc8f6fe8c0c35917da118e2aa2f90d373b49ad3981f58a472d86ab218fedb041",
    "apps/room/src/projection-page.ts": "sha256:ec6568fd41ba6828fcb74546a10c44b077a9019ac515652720bc8cc4fff3ede2",
    "fixtures/r4-gate-b-core/codex/initialize-result.json": "sha256:9f95c243a31d03b62a9c14d186f4eb683a616a15b4fa5dcad0b5c3c3c8dedfbf",
    "fixtures/r4-gate-b-core/postgres/core-errors.sql": "sha256:3633b61d323918b31760658850420d27b2e52ed7074d32299ecdcf3fa35e3410",
    "fixtures/r4-gate-b-core/postgres/core-happy-path.sql": "sha256:65b4817bfc146216b2034fcea4b1d3dfc33aa82d7db69e1d67d4cfcfd2665e59",
    "fixtures/r4-gate-b-core/postgres/core-races.sql": "sha256:a2dc6f9b593fc72bc5ff39af246ac7681ac76efdb621e9601717f056ad59d5b2",
    "native/macos/Package.swift": "sha256:efb3e7b7d683fc612bf7c8715e5888eb54cde0544a33e42cdb3a853787610467",
    "native/macos/Resources/FormeCoreLocal.Info.plist": "sha256:285990b2afa108cd1fcbd406bc79f1fc81be2894fb1767808cd4898940878192",
    "native/macos/Resources/FormeCoreLocal.entitlements": "sha256:97704a8960b4facceef54397a08fb5d0a456247c3627359215aa2a27df22656c",
    "native/macos/Sources/FormeCoreLocal/CoreLauncher.swift": "sha256:9a4edcea641064ffd2b905dbe3e462fc81a10421d464c5cd39956757d548de07",
    "native/macos/Sources/FormeCoreLocal/CoreLockedMemory.swift": "sha256:08d948ec1be5c5fc953c595a58a9c1d2bded04644ec27adae37508c801773a41",
    "native/macos/Sources/FormeCoreLocal/CorePhysicalEvidence.swift": "sha256:2b25fc54359eb7dab512ab11ec532faea1de10d3167adb873c0000d4ea0dd310",
    "native/macos/Sources/FormeCoreLocal/CoreProcessSupervisor.swift": "sha256:4ebc7e8916a92aa2e7be35231284f1f4d44a90888b28241e6f587a21936ceb2c",
    "native/macos/Sources/FormeCoreLocal/CoreSandboxProfile.swift": "sha256:b42a9f8fa25f91ff8c94ad4f6d0bb1e435e6984c99e05f3e12b282babb06716e",
    "native/macos/Sources/FormeCoreLocal/CountingHandoffPort.swift": "sha256:5002f68acfa8c4004240a415ff6cd5323e574ac5d4639dbea452db2b7abe8a4d",
    "native/macos/Sources/FormeCoreLocal/TransientCandidateReviewWindow.swift": "sha256:cd12d469cfab479c201570232eca79560cfee423b67e08cc75836ec1b2b58a56",
    "native/macos/Sources/FormeCoreLocal/TransientCandidateSession.swift": "sha256:5c1e0aee09a0f3a2fae0d4512a82db69c1602fbc2e1713b6eac03394bc1dfdff",
    "native/macos/Sources/FormeCoreLocal/UserPresenceAuthorizer.swift": "sha256:c4966b58c96fe7685d8ef84039493eb152c08aabf59461beaceb0ba1c2f6f99d",
    "native/macos/Tests/FormeCoreLocalTests/TransientCandidateTests.swift": "sha256:7a42b24489e4532b6272c8c9233bc65403ce127dd70ee846aa6cf14f74f72e91",
    "package.json": "sha256:dabd1b05643e6fcc1d1dd02cae9b649915cc40b36f8b36d2e6e1618bcf5d6652",
    "packages/r4-codex-adapter/src/index.ts": "sha256:3b607a51d508a298aa52e4eaae9cc4e0ee90c8ee02d3cb59ad8595064ac989c9",
    "packages/r4-codex-adapter/src/zero-call-physical.ts": "sha256:ba210b723fd2c03f08a84b1b28b1e609f9a9fe2b7153b135137275fdf73d65dc",
    "packages/r4-local/src/cli.ts": "sha256:0e4e0e7cc5b7cc44328ccc7b0dff7e2f7322d098ee6fef26aaa7ee8e0ed04c6c",
    "packages/r4-local/src/hosted-room-api.ts": "sha256:2eaada04b37b9f7b5d43d0b6463e352973f89990f408097412b791aa82fc5c72",
    "packages/r4-local/src/index.ts": "sha256:d1ac7409b10d6b365539616da347e34a424cbf688af0fa45e439f86df3f42b54",
    "schemas/r4/gate-b-core/README.md": "sha256:2efac708c4c1d1e8e376b62ba54092e47f7f460ddf7018852fcd04fafe6d6bab",
    "schemas/r4/gate-b-core/api-v1-index.json": "sha256:ff029f3988b9fbd734bf797c1309548fd056304fba8c7dbc1605305a35e5cdf5",
    "schemas/r4/gate-b-core/api-v1.schema.json": "sha256:b6877ca0d9ea309f558504f0499115e16c7c9276785ba4ff8ae25f5c81ec1251",
    "schemas/r4/gate-b-core/artifact-index.json": "sha256:9190e0da378fcdfde57453880895edaef2612ac55532785773580798fc5c3a85",
    "schemas/r4/gate-b-core/codex-zero-call-contract.json": "sha256:1f7cc3e7db61b1d0f3fcd564b3a00d68004a7a2198b331dbe995e6a2004d0412",
    "schemas/r4/gate-b-core/core-basis.json": "sha256:eabd968569b8245a7d6ed15493a3e79a59c913304e8d429169bf611b3d173d35",
    "schemas/r4/gate-b-core/evidence.schema.json": "sha256:34bda9a95ea6aa13047aa12c25f656e051a95c107416d4a2c50c20ba2343a9e1",
    "schemas/r4/gate-b-core/macos/build-recipe.json": "sha256:da6c5ff813bd4863ce99d642b0a57e41754eeac8444bfbfad9f96fe54c97bcb9",
    "schemas/r4/gate-b-core/macos/evidence.schema.json": "sha256:08eb1e8331ddcb1fd1c6c84762ad285550420a9ef685394db2415c033b53f81f",
    "schemas/r4/gate-b-core/macos/forme-codex-zero-call.sb": "sha256:0c6dc1dda5c97f9d3773bc2ccbd49b28c8ba1b02f7f6b55180db7b2672a9d2ce",
    "schemas/r4/gate-b-core/macos/forme-core-transient-response.sb": "sha256:3a8c17648b02e0bcebedbcf1405de3fa4d4ca7ceb4c324e0b4969676d777732c",
    "schemas/r4/gate-b-core/macos/transient-candidate-contract.json": "sha256:9fb4efe68883e4985062b4a3d02699d69e6de5687174fce9e4661a0270e324dc",
    "schemas/r4/gate-b-core/operations.md": "sha256:d32a5a54b2f8dca432279b27553a461d05636b7ee9d5ca022796a9a427ea9108",
    "schemas/r4/gate-b-core/postgres-contract.md": "sha256:093ef9f6ad869cebc134555dd5562b32ea59162a254442beaac272d81138d8f4",
    "schemas/r4/gate-b-core/runtime-boundary.json": "sha256:97601dec99c2044025619cef88833e3da974091e7704eed406f3e10391f5e1d4",